{
  "version": "1.0",
  "name": "Multi-action cell combinations",
  "description": "Demonstrates all 15 non-empty combinations of player action types",
  "config": {
    "totalTicks": 16,
    "rowOrder": [
      "boss",
      "atk",
      "spl",
      "utl",
      "dth",
      "atk_spl",
      "atk_utl",
      "atk_dth",
      "spl_utl",
      "spl_dth",
      "utl_dth",
      "atk_spl_utl",
      "atk_spl_dth",
      "atk_utl_dth",
      "spl_utl_dth",
      "atk_spl_utl_dth"
    ]
  },
  "timeline": {
    "actors": [
      { "type": "npc", "id": "boss", "npcId": 99999, "name": "Boss" },

      { "type": "player", "id": "atk", "name": "Atk" },
      { "type": "player", "id": "spl", "name": "Spl" },
      { "type": "player", "id": "utl", "name": "Utl" },
      { "type": "player", "id": "dth", "name": "Death" },
      { "type": "player", "id": "atk_spl", "name": "AtkSpl" },
      { "type": "player", "id": "atk_utl", "name": "AtkUtl" },
      { "type": "player", "id": "atk_dth", "name": "AtkDeath" },
      { "type": "player", "id": "spl_utl", "name": "SplUtl" },
      { "type": "player", "id": "spl_dth", "name": "SplDeath" },
      { "type": "player", "id": "utl_dth", "name": "UtlDeath" },
      { "type": "player", "id": "atk_spl_utl", "name": "AtkSplUtl" },
      { "type": "player", "id": "atk_spl_dth", "name": "AtkSplDeath" },
      { "type": "player", "id": "atk_utl_dth", "name": "AtkUtlDeath" },
      { "type": "player", "id": "spl_utl_dth", "name": "SplUtlDeath" },
      { "type": "player", "id": "atk_spl_utl_dth", "name": "AllActions" }
    ],
    "ticks": [
      {
        "tick": 0,
        "cells": [
          {
            "actorId": "atk",
            "actions": [
              {
                "type": "attack",
                "attackType": "SCYTHE",
                "weaponId": 22325,
                "targetActorId": "boss"
              }
            ]
          }
        ]
      },
      {
        "tick": 1,
        "cells": [
          {
            "actorId": "spl",
            "actions": [{ "type": "spell", "spellType": "VENGEANCE" }]
          }
        ]
      },
      {
        "tick": 2,
        "cells": [
          {
            "actorId": "utl",
            "actions": [{ "type": "utility", "utilityType": "SURGE_POTION" }]
          }
        ]
      },
      {
        "tick": 3,
        "cells": [
          {
            "actorId": "dth",
            "actions": [{ "type": "death" }]
          }
        ]
      },
      {
        "tick": 4,
        "cells": [
          {
            "actorId": "atk_spl",
            "actions": [
              {
                "type": "attack",
                "attackType": "SCYTHE",
                "weaponId": 22325,
                "targetActorId": "boss"
              },
              { "type": "spell", "spellType": "VENGEANCE" }
            ]
          }
        ]
      },
      {
        "tick": 5,
        "cells": [
          {
            "actorId": "atk_utl",
            "actions": [
              {
                "type": "attack",
                "attackType": "SCYTHE",
                "weaponId": 22325,
                "targetActorId": "boss"
              },
              { "type": "utility", "utilityType": "SURGE_POTION" }
            ]
          }
        ]
      },
      {
        "tick": 6,
        "cells": [
          {
            "actorId": "atk_dth",
            "actions": [
              { "type": "death" },
              {
                "type": "attack",
                "attackType": "SCYTHE",
                "weaponId": 22325,
                "targetActorId": "boss"
              }
            ]
          }
        ]
      },
      {
        "tick": 7,
        "cells": [
          {
            "actorId": "spl_utl",
            "actions": [
              { "type": "spell", "spellType": "VENGEANCE" },
              { "type": "utility", "utilityType": "SURGE_POTION" }
            ]
          }
        ]
      },
      {
        "tick": 8,
        "cells": [
          {
            "actorId": "spl_dth",
            "actions": [
              { "type": "spell", "spellType": "VENGEANCE" },
              { "type": "death" }
            ]
          }
        ]
      },
      {
        "tick": 9,
        "cells": [
          {
            "actorId": "utl_dth",
            "actions": [
              { "type": "utility", "utilityType": "SURGE_POTION" },
              { "type": "death" }
            ]
          }
        ]
      },
      {
        "tick": 10,
        "cells": [
          {
            "actorId": "atk_spl_utl",
            "actions": [
              {
                "type": "attack",
                "attackType": "SCYTHE",
                "weaponId": 22325,
                "targetActorId": "boss"
              },
              { "type": "spell", "spellType": "VENGEANCE" },
              { "type": "utility", "utilityType": "SURGE_POTION" }
            ]
          }
        ]
      },
      {
        "tick": 11,
        "cells": [
          {
            "actorId": "atk_spl_dth",
            "actions": [
              { "type": "spell", "spellType": "VENGEANCE" },
              {
                "type": "attack",
                "attackType": "SCYTHE",
                "weaponId": 22325,
                "targetActorId": "boss"
              },
              { "type": "death" }
            ]
          }
        ]
      },
      {
        "tick": 12,
        "cells": [
          {
            "actorId": "atk_utl_dth",
            "actions": [
              {
                "type": "attack",
                "attackType": "SCYTHE",
                "weaponId": 22325,
                "targetActorId": "boss"
              },
              { "type": "utility", "utilityType": "SURGE_POTION" },
              { "type": "death" }
            ]
          }
        ]
      },
      {
        "tick": 13,
        "cells": [
          {
            "actorId": "spl_utl_dth",
            "actions": [
              { "type": "spell", "spellType": "VENGEANCE" },
              { "type": "utility", "utilityType": "SURGE_POTION" },
              { "type": "death" }
            ]
          }
        ]
      },
      {
        "tick": 14,
        "cells": [
          {
            "actorId": "atk_spl_utl_dth",
            "actions": [
              {
                "type": "attack",
                "attackType": "SCYTHE",
                "weaponId": 22325,
                "targetActorId": "boss"
              },
              { "type": "spell", "spellType": "VENGEANCE" },
              { "type": "utility", "utilityType": "SURGE_POTION" },
              { "type": "death" }
            ]
          }
        ]
      }
    ]
  }
}
