{
  "version": "1.0",
  "name": "Custom action type examples",
  "config": {
    "totalTicks": 15,
    "rowOrder": ["boss", "p1"]
  },
  "timeline": {
    "actors": [
      { "type": "npc", "id": "boss", "npcId": 99999, "name": "New Boss" },
      { "type": "player", "id": "p1", "name": "FuturePlayer" }
    ],
    "ticks": [
      {
        "tick": 0,
        "cells": [
          {
            "actorId": "p1",
            "actions": [
              {
                "type": "attack",
                "attackType": "SCYTHE",
                "weaponId": 22325,
                "targetActorId": "boss"
              }
            ]
          }
        ]
      },
      {
        "tick": 1,
        "cells": [
          {
            "actorId": "p1",
            "actions": [
              {
                "type": "attack",
                "attackType": "DEMONBANE_CUTLASS",
                "targetActorId": "boss",
                "display": {
                  "iconUrl": "https://blert.io/images/combat/dark-demonbane.webp",
                  "letter": "dc",
                  "style": "melee"
                }
              }
            ]
          }
        ]
      },
      {
        "tick": 2,
        "cells": [
          {
            "actorId": "p1",
            "actions": [
              {
                "type": "attack",
                "attackType": "DEMONBANE_CUTLASS_SPEC",
                "targetActorId": "boss",
                "specCost": 50,
                "display": {
                  "iconUrl": "https://blert.io/images/combat/dark-demonbane.webp",
                  "letter": "DC",
                  "style": "melee"
                }
              }
            ]
          }
        ]
      },
      {
        "tick": 3,
        "cells": [
          {
            "actorId": "p1",
            "actions": [
              {
                "type": "attack",
                "attackType": "DEMONBANE_CUTLASS_SPEC",
                "targetActorId": "boss",
                "display": {
                  "iconUrl": "https://blert.io/images/combat/dark-demonbane.webp",
                  "letter": "DC",
                  "style": "melee"
                }
              }
            ]
          }
        ]
      },
      {
        "tick": 4,
        "cells": [
          {
            "actorId": "p1",
            "actions": [{ "type": "attack", "attackType": "UNKNOWN" }]
          }
        ]
      },
      {
        "tick": 5,
        "cells": [
          {
            "actorId": "p1",
            "actions": [
              {
                "type": "attack",
                "attackType": "UNKNOWN",
                "display": {
                  "iconUrl": "https://blert.io/images/combat/punch.webp",
                  "letter": "?",
                  "style": "melee"
                }
              }
            ]
          }
        ]
      },
      {
        "tick": 6,
        "cells": [
          {
            "actorId": "p1",
            "actions": [
              {
                "type": "attack",
                "attackType": "UNKNOWN_BARRAGE",
                "display": {
                  "iconUrl": "https://blert.io/images/combat/kick.webp",
                  "letter": "UNK",
                  "style": "magic"
                }
              }
            ]
          }
        ]
      },
      {
        "tick": 7,
        "cells": [
          {
            "actorId": "boss",
            "actions": [
              {
                "type": "npcAttack",
                "attackType": "INFERNO_JAD_MAGE",
                "targetActorId": "p1"
              }
            ]
          }
        ]
      },
      {
        "tick": 8,
        "cells": [
          {
            "actorId": "boss",
            "actions": [
              {
                "type": "npcAttack",
                "attackType": "FUTURE_BOSS_LASER",
                "targetActorId": "p1",
                "display": {
                  "iconUrl": "https://blert.io/images/prayers/overhead-ranged-magic-melee.png",
                  "description": "Giga boss laser"
                }
              }
            ]
          }
        ]
      },
      {
        "tick": 9,
        "cells": [
          {
            "actorId": "boss",
            "actions": [
              {
                "type": "npcAttack",
                "attackType": "UNKNOWN",
                "targetActorId": "p1",
                "display": {
                  "iconUrl": "https://blert.io/images/prayers/overhead-magic-melee.png"
                }
              }
            ]
          }
        ]
      },
      {
        "tick": 10,
        "cells": [
          {
            "actorId": "boss",
            "actions": [
              {
                "type": "npcAttack",
                "attackType": "UNKNOWN"
              }
            ]
          }
        ]
      },
      {
        "tick": 11,
        "cells": [
          {
            "actorId": "p1",
            "actions": [{ "type": "spell", "spellType": "DEATH_CHARGE" }]
          }
        ]
      },
      {
        "tick": 12,
        "cells": [
          {
            "actorId": "p1",
            "actions": [
              {
                "type": "spell",
                "spellType": "DRAGONFIRE_BLAST",
                "display": {
                  "iconUrl": "https://blert.io/images/prayers/augury.png",
                  "name": "Dragonfire Blast"
                }
              }
            ]
          }
        ]
      },
      {
        "tick": 13,
        "cells": [
          {
            "actorId": "p1",
            "actions": [
              {
                "type": "spell",
                "spellType": "UNKNOWN",
                "display": {
                  "iconUrl": "https://blert.io/images/skills/prayer.webp"
                }
              }
            ]
          }
        ]
      },
      {
        "tick": 14,
        "cells": [
          {
            "actorId": "p1",
            "actions": [
              {
                "type": "spell",
                "spellType": "UNKNOWN"
              }
            ]
          }
        ]
      }
    ]
  }
}
